{
  "schema_version": "m1",
  "workflow_revision_id": "workflow-rev-simple-001",
  "artifact_lifecycle_state": "approval_pending",
  "requests": [
    {
      "request_id": "approval-request-001",
      "node_id": "retrieve-1",
      "approval_subject_hash": "approval-subject-001",
      "reason": "Fixture approval request."
    }
  ]
}
